<?xml version="1.0" encoding="UTF-8"?>
<xs:schema xmlns:xs="http://www.w3.org/2001/XMLSchema">
    <xs:element name="curs">
        <xs:complexType>
            <xs:sequence>
                <xs:element name="modul" maxOccurs="unbounded">
                    <xs:complexType>
                        <xs:sequence>
                            <xs:element name="nom" type="xs:string"/>
                            <xs:element name="codi" type="xs:string"/>
                            <xs:element name="professor" type="xs:string" maxOccurs="2"/>
                            <xs:element name="temes" minOccurs="0">
                                <xs:complexType>
                                    <xs:sequence>
                                        <xs:element name="tema" maxOccurs="unbounded">
                                            <xs:complexType>
                                                <xs:sequence>
                                                    <xs:element name="titol" type="xs:string"/>
                                                    <xs:element name="descripcio" type="xs:string"/>
                                                </xs:sequence>
                                            </xs:complexType>
                                        </xs:element>
                                    </xs:sequence>
                                </xs:complexType>
                            </xs:element>
                            <xs:element name="recursos" minOccurs="0">
                                <xs:complexType>
                                    <xs:sequence>
                                        <xs:element name="recurs" maxOccurs="unbounded">
                                            <xs:complexType>
                                                <xs:sequence>
                                                    <xs:element name="tipus" type="xs:string"/>
                                                    <xs:element name="nom" type="xs:string"/>
                                                    <xs:element name="enllac" type="xs:string" minOccurs="0"/>
                                                    <xs:element name="autor" type="xs:string" minOccurs="0"/>
                                                </xs:sequence>
                                            </xs:complexType>
                                        </xs:element>
                                    </xs:sequence>
                                </xs:complexType>
                            </xs:element>
                        </xs:sequence>
                    </xs:complexType>
                </xs:element>
            </xs:sequence>
        </xs:complexType>
    </xs:element>
</xs:schema>
